{
  "id": "releases/2026-01-05/methods.json",
  "kind": "methods",
  "format": "methods/1.0",
  "provenance": {
    "release": "2026-01-05",
    "sources": ["example"],
    "licences": ["CC-BY-4.0"],
    "gbif_download_dois": ["10.0000/example"],
    "method": "test-1",
    "taxonomy": "test-taxonomy",
    "boundaries": "test-boundaries",
    "ranges": null,
    "protection": null,
    "code": "0.0.0",
    "run": "run-1"
  },
  "data": {
    "method": "test-1",
    "data_rules": "1.0",
    "thresholds": {
      "records": 20,
      "years": 5
    },
    "weeks": "Week 1 is 1–7 January.",
    "pooled_from": "2015-01-01",
    "taxonomy": "test-taxonomy",
    "boundaries": "test-boundaries",
    "protection": {},
    "ranges": [],
    "limits": "Made up."
  }
}
